Date,Company/Brand,Founded,HeadQuarter,Founders,Investor,Amount($),Stage,Year,Sector
2021-08-31,Pocket Aces,2013,Mumbai,"Anirudh Pandita, Aditi Shrivastava, Ashwin Suresh","3one4 Capital, DSP Group",2000000.0,Seed,2021,Media/Entertainment
2021-08-31,Rebel Foods,2011,Mumbai,"Jaydeep Barman, Kallol Banerjee.",Qatar Investment Authority,175000000.0,Series F,2021,Technology
2021-08-31,Mobileware Technologies,2008,Mumbai,"Amitabh Kanekar, Satyajit Kanekar",Kvanto Payment Services,4700000.0,Seed,2021,Technology
2021-09-01,Lysto,2021,Bangalore,Sadiq Ahamed,BEENEXT,3000000.0,Seed,2021,FinTech
2021-09-01,Zoko,2016,Bangalore,"Arjun Paul, Aromal Sivadasan",Y Combinator,140000000.0,Seed,2021,Technology
2021-09-01,Flexmoney,2015,Mumbai,Yezdi Lashkari,Pravega Ventures,4800000.0,Series A,2021,FinTech
2021-09-01,Dream Sports,2008,Mumbai,Harsh Jain,"Falcon Edge, DST Global, D1 Capital, Redbird Capital, Tiger Global",840000000.0,Seed,2021,Gaming
2021-09-01,DealShare,2018,Jaipur,"Sankar Bora, Sourjyendu Medda, Vineet Rao","Omidyar Network, Falcon Edge Capital",3000000.0,Debt,2021,E-Commerce
2021-09-01,Cellestial,2019,Hyderabad,Siddhartha Durairajan,"Gurj Aujla, Ashik K",500000.0,Pre-series A,2021,Other
2021-09-03,Hashnode,2016,Bangalore,"Syed Fazle Rahman, Sandeep Panda","Salesforce Ventures, Sierra Ventures, Sequoia Capital India’s Surge",6700000.0,Series A,2021,Other
2021-09-03,Endimension,2018,Mumbai,"Bharadwaj Kss, Apparao MLV, Kurien Zacharia",Inflection Point Ventures,300000.0,Seed,2021,Automotive
2021-09-03,Jobsgaar,2020,New Delhi,Atul Pratap Singh,SucSEED Indovation Fund,140000.0,Seed,2021,Other
2021-09-04,Wingreens Farms,2011,Gurugram,"Anju C Srivastava, Arjun Srivastava","Investcorp, Omidyar Network",17000000.0,Seed,2021,Consumables
2021-09-04,Soothe Healthcare,2012,New Delhi,Sahil Dharia,A91 Partners,10000000.0,Series C,2021,Consumer Services
2021-09-04,Unbox Robotics,2019,Pune,"Pramod Ghadge, Shahid Memon, Rohit Pitale","3one4 Capital, Sixth Sense Ventures",7000000.0,Series A,2021,Logistics
2021-09-05,MergerDomo,2018,New Delhi,Hormazd Charna,Nadir B Godrej,500000.0,Seed,2021,Finance
2021-09-06,Taikee,2010,Mumbai,"Nidhi Ramachandran, Sachin Chhabra",Inflection Point Ventures,1000000.0,Seed,2021,E-Commerce
2021-09-06,Lumiq,2013,Noida,Shoaib Mohammad,Info Edge Ventures,2000000.0,Seed,2021,Technology
2021-09-06,Porter,2014,Bangalore,"Pranav Goel, Uttam Digga, Vikas Choudhary","Tiger Global, Vitruvian Partners",100000000.0,Series E,2021,Logistics
2021-09-06,Enguru,2014,Bangalore,"Arshan Vakil, Tahem Veer Verma, Udit Hinduja","Potencia Ventures, Bisk Ventures, LetsVenture, Ronnie Screwvala, Arihant Patni",169032154.0,Pre-series A,2021,Education
2021-09-06,DealShare,2018,Jaipur,"Sankar Bora, Sourjyendu Medda, Vineet Rao","Tiger Global Management, InnoVen Capital",9000000.0,Seed,2021,E-Commerce
2021-09-07,Acko,2016,Bangalore,"Varun Dua, Ruchi Deepak","General Atlantic, Multiples",255000000.0,Series D,2021,Finance
2021-09-07,AgroStar,2013,Pune,"Shardul, Sitanshu Sheth","Evolvence, Hero Enterprise",70000000.0,Series D,2021,Technology
2021-09-08,Leap Finance,2019,Bangalore,Vaibhav Singh,Jungle Ventures,17000000.0,Series B,2021,FinTech
2021-09-08,Mindler,2015,New Delhi,Prateek Bhargava,"Inflection Point Ventures, DLabs",1000000.0,Pre-series A,2021,Education
2021-09-08,Mailmodo,2020,Bangalore,"Aquibur Rahman, Apurv Gupta, Devyesh Tandon","Sequoia’s Surge, Y Combinator",2000000.0,Seed,2021,Marketing
2021-09-09,SuperBottoms,2015,Mumbai,Pallavi Utagi,Alteria Capital,400000.0,Seed,2021,Consumer Services
2021-09-09,Log 9 Materials,2014,Bangalore,"Akshay Singhal, Kartik Hajela",Amara Raja Batteries,8500000.0,Series A+,2021,Technology
2021-09-09,D’Moksha Homes,2020,Mumbai,"Nimisha, Manav Dhanda","Apoorva Sharma, The Chennai Angels, Karthik Bhat",570000.0,Seed,2021,Lifestyle
2021-09-09,Kirana247,2018,New Delhi,"Tarun Jiwarajka, Pankhuri Jiwarajka",Inflection Point Ventures,1000000.0,Seed,2021,Logistics
2021-09-10,Anar Business Community,2020,Mumbai,"Nishank Jain, Sanjay Bhat","Titan Capital, First Cheque",169032154.0,Seed,2021,Technology
2021-09-10,Miko,2015,Mumbai,"Sneh R Vaswani, Prashant V Iyengar, Chintan S Raikar","IIFL AMC, Mankind Pharma Family Office, Aroa Ventures",28000000.0,Seed,2021,Consumer Services
2021-09-10,TruNativ,2019,Mumbai,"Pranav Malhotra, Mamta Malhotra",9Unicorns,169032154.0,Seed,2021,Consumables
2021-09-11,CanPe,2019,Bangalore,Arindam Choudhury,Axilor Ventures,169032154.0,Seed,2021,Other
2021-09-11,Spinny,2015,Gurugram,"Mohit Gupta, Niraj Singh, Ramanshu Mahaur","Arena Holdings, Think Investments",65000000.0,Series C,2021,Consumer Services
2021-09-12,TartanSense,2015,Bangalore,Jaisimha Rao,"FMC, Omnivore, Blume Ventures",5000000.0,Seed,2021,Technology
2021-09-12,Totality,2017,Gurugram,Anshul Rustaggi,"Leo Capital, Mayfield Fund",1000000.0,Seed,2021,Media/Entertainment
2021-09-12,OYO,2012,Gurugram,Ritesh Agarwal,Hindustan Media Venture,200000000.0,Seed,2021,Hospitality
2021-09-12,Finsall,2019,Bangalore,"Prabal Khanna, Tim Mathews",Unicorn India Ventures,300000.0,Seed,2021,Other
2021-09-12,CometChat,2009,Mumbai,"Anuj, Anant Garg",Signal Peak Ventures,10000000.0,Series A,2021,Technology
2021-09-13,Zorro,2021,Gurugram,"Jasveer Singh, Abhishek Asthana, Deepak Kumar","Vijay Shekhar Sharma, Ritesh Agarwal, Ankiti Bose",32000000.0,Seed,2021,Technology
2021-09-13,Speciale Invest,2017,Bangalore,"Vishesh Rajaram, Arjun Rao",Inflection Point Ventures,10000000.0,Seed,2021,FinTech
2021-09-14,Keka HR,2014,Hyderabad,Vijay Yalamanchili,Recur Club,1600000.0,Seed,2021,Technology
2021-09-14,Kodo Card,2019,Mumbai,"Deepti Sanghi, Gaurav Thapa","Brex, Y-Combinator",8000000.0,Seed,2021,FinTech
2021-09-14,Lendingkart,1999,Gujarat,"Harshvardhan Lunia, Mukul Sachan","Bertelsmann India Investments, Fullerton Financial Holdings",15000000.0,Debt,2021,FinTech
2021-09-15,DGV,2019,Bangalore,Ragavan Venkatesan,"Info Edge Ventures, Omnivore",3000000.0,Pre-series A,2021,Technology
2021-09-15,Refyne,2020,Bangalore,"Chitresh Sharma, Apoorv Kumar","DST Global, RTP Global",20000000.0,Series A,2021,FinTech
2021-09-15,Chalo,2014,Mumbai,"Vinayak Bhavnani, Mohit Dubey","Lightrock India, Filter Capital",40000000.0,Series C,2021,Logistics
2021-09-15,Bolkar,2018,Bangalore,"Abhishek Tripathi, Dhruv Kaushal, Prince Tripathi, Saurabh Rai","GSF, Pras Hanuma",169032154.0,Seed,2021,Technology
2021-09-15,Urban Company,2014,New Delhi,"Abhiraj Singh Bhal, Raghav Chandra, Varun Khaitan",Vy Capital,188000000.0,Seed,2021,Other
2021-09-15,GoTo,2020,Ghaziabad,"Akhilesh Sagar, Harsh Vardhan Sharma",Jesse Lucas,150000.0,Seed,2021,Logistics
2021-09-16,Fabriclore,2016,Jaipur,"Vijay Sharma, Anupam Arya, Sandeep Sharma","Fluid Ventures, Mulberry Silks",700000.0,Pre-series A,2021,Lifestyle
2021-09-16,Dream Sports,2008,Mumbai,"Bhavit Sheth, Harsh Jain","TCV, D1 Capital Partners, Falcon Edge.",400000000.0,Seed,2021,Gaming
2021-09-16,Gyde,2019,Pune,"Prasanna Vaidya, Shubham Deshmukh","Better Capital, Ashish Achrekar",250000.0,Seed,2021,Other
2021-09-16,Supply6,2018,Bangalore,"Rahul Jacob, Vaibhav Bhandari","Rohit Goutamchand, India CXO Fund",100000.0,Seed,2021,Automotive
2021-09-16,Indic Inspirations,2019,Pune,Sunil Jalihal,Marquee investors,300000.0,Seed,2021,Other
2021-09-17,ElectricPe,2021,Bangalore,"Avinash Sharma, Raghav Rohila","Blume Ventures, Micelio Fund",3000000.0,Seed,2021,Energy
2021-09-17,Coinshift,2021,Chandigarh,Tarun Gupta,"Sequoia Capital, Sandeep Nailwal",2500000.0,Seed,2021,Technology
2021-09-17,Vendor Infra,2019,Gurugram,Rahul Jain,"SK Tripathi, Sanjeev Gupta",265000.0,Seed,2021,Real Estate
2021-09-17,Uable,2020,Bangalore,Saurabh Saxena,"JAFCO Asia, Chiratae Ventures",35000000.0,Pre-series A,2021,Education
2021-09-17,Chara,2019,Bangalore,"Bhaktha Keshavachar, Ravi Prasad Sharma, Mahalingam Koushik",Kalaari Capital,850000.0,Seed,2021,Technology
2021-09-18,Imagimake,2011,Mumbai,"Disha Katharani, Ravi Kumar","Roha Investment Managers, angel investor Saumil Shah",500000.0,Pre-series A,2021,Technology
2021-09-19,LifeCell,2004,Chennai,S. Abhaya Kumar,Orbimed Asia Partners,30000000.0,Seed,2021,Healthcare
2021-09-19,ExtraaEdge,2015,Pune,"Abhishek Ballabh, Sushil Mundada","9Unicorns Accelerator Fund, Indian Angel Network",1000000.0,Pre-series A,2021,Technology
2021-09-19,Goodmeetings,2020,Bangalore,Srinivasan Narayan,Chiratae Ventures,1700000.0,Series A,2021,Other
2021-09-19,Pristyn Care,2018,Gurugram,Harsimarbir (Harsh) Singh,"Sequoia Capital India, Hummingbird Ventures",53000000.0,Series D,2021,Healthcare
2021-09-19,BlackBuck,2015,Bangalore,"B Ramasubramanian, Chanakya Hridaya, Rajesh Yabaji","Tribe Capital, IFC Emerging Asia Fund, VEF",67000000.0,Series E,2021,Logistics
2021-09-20,Marquee Equity,2016,Mumbai,Ash Narain,"Capital One, Arrowroot Capital",3800000.0,Seed,2021,FinTech
2021-09-20,Medikabazaar,2014,Mumbai,"Vivek Tiwari, Ketan Malkan","CDC Group, Creaegis",75000000.0,Series C,2021,Healthcare
2021-09-20,Atomberg Technologies,2012,Mumbai,"Manoj Meena, Sibabrata Das",Ka Enterprises,169032154.0,Seed,2021,Consumer Services
2021-09-21,The Viral Fever,2012,Mumbai,Arunabh Kumar,BlackSoil,2000000.0,Seed,2021,Media/Entertainment
2021-09-22,Grinntech,2013,Chennai,"Nikhilesh Mishra, Puneet Jain",Inflection Point Ventures,2000000.0,Seed,2021,Automotive
2021-09-22,Sugar.fit,2021,Bangalore,"Shivtosh Kumar, Madan Somasundaram","Cure.fit, Endiya Partners, Tanglin Venture",10000000.0,Seed,2021,Healthcare
2021-09-22,Fittr,2016,Pune,"Rohit Chattopadhyay, Jitendra Chouksey, Suniel Shetty, Sonal Singh, Bala Dabbedi","Dream Capital, Elysian Park Ventures",11000000.0,Series A,2021,Wellness/Beauty
2021-09-24,DotPe,2019,Gurugram,"Anurag Gupta, Gyanesh Sharma, Shailaz Nag","Info Edge, Ruizheng Investment",8000000.0,Seed,2021,FinTech
2021-09-24,Northern Arc,2008,Chennai,Kshama Fernandes,"Asian Development Bank, U.S. International Development Finance Corp",50000000.0,Debt,2021,FinTech
2021-09-26,Comofi Medtech,2018,Bangalore,Gururaj KB,"CIIE.CO, KIIT-TBI",200000.0,Seed,2021,Healthcare
2021-09-26,Ninety One,2015,Ahmedabad,"Sachin Chopra, Vishal Chopra",A91 Partners,30000000.0,Series A,2021,Consumer Services
2021-09-27,ION Energy,2016,Mumbai,Akhil Aryan,Inflection Point Ventures,3600000.0,Pre-series A,2021,Automotive
2021-09-27,Digantara,2018,Bangalore,"Anirudh N Sharma, Rahul Rawat, Tanveer Ahmed",Kalaari Capital,2500000.0,Seed,2021,Technology
2021-09-27,Wiingy,2021,Bangalore,Asit Biswal,Aroa Ventures,400000.0,Seed,2021,Other
2021-09-27,Loop Health,2018,Pune,"Amrit Singh, Mayank Kale","Elevation, General Catalyst",12000000.0,Seed,2021,Automotive
2021-09-27,Lavado,2016,Mumbai,Disha Jain,Ashish Shah,169032154.0,Seed,2021,Consumer Services
2021-09-27,Bizongo,2015,Mumbai,"Aniket Deb, Ankit Tomar, Sachin Agrawal","CDC Group, IDG Capital",51000000.0,Series C,2021,E-Commerce
2021-09-28,ForeignAdmits,2018,Bangalore,"Nikhil Jain, Ashwini Jain",Unicorn India Ventures,400000.0,Seed,2021,Education
2021-09-28,Chingari,2018,Bangalore,Sumit Ghosh,"FJ Labs, Brian Norgard",13000000.0,Seed,2021,Media/Entertainment
2021-09-28,Unbox Robotics,2019,Bangalore,"Pramod Ghadge, Shahid Memon","BEENEXT, Entrepreneur First",1200000.0,Pre-series A,2021,Technology
2021-09-28,Inficold,2015,New Delhi,"Himanshu Pokharna, Nitin Goel",Shell Foundation,900000.0,Pre-series A,2021,Energy
2021-09-28,Bombay Shaving Company,2016,New Delhi,"Deepu Panicker, Raunak Munot, Rohit Jaiswal, Shantanu Deshpande","Sixth Sense Ventures, Colgate Palmolive",6000000.0,Seed,2021,Lifestyle
2021-09-29,Siply,2020,Bangalore,"Sousthav Chakrabarty, Anil Bhat","LetsVenture, AngelList India, Founder's Room Circle",3200000.0,Pre-series A,2021,Finance
2021-09-29,GoSats,2020,Bangalore,"Mohammed Roshan, Roshni Aslam","Alphabit Fund, Fulgur Ventures, Stacks Accelerator, SBX Capital",700000.0,Seed,2021,FinTech
2021-09-29,Rockclimber,2019,Bangalore,"Deepak Poduval, Hariprasad Shetty",Anand Prakash Sharma,1000000.0,Seed,2021,Consumables
2021-09-29,The Ayurveda Co,2021,Gurugram,"Param Bhargava, Shreedha Singh","GetVantage, Velocity, Shiprocket Capital",169032154.0,Seed,2021,Consumer Services
2021-09-29,Go Swift,2019,Bangalore,"Shyam Kalita, Debanshu Sinha, Prayas Mittal",Kalaari Capital,2000000.0,Pre-series A,2021,Consumer Services
2021-09-30,IndiaLends,2014,New Delhi,"Gaurav Chopra, Mayank Kachhwaha","ACPI Investments, AdvantEdge Founders",5100000.0,Seed,2021,FinTech
2021-09-30,Playo,2014,Bangalore,Daanish Suhail,ah! Ventures High Tables,500000.0,Pre-series A,2021,Gaming
2021-09-30,Indi Energy,2019,Roorkee,Dr. ASIT SAHOO,Mumbai Angels Network,169032154.0,Seed,2021,Energy
2021-09-30,Devic Earth,2018,Bangalore,Dr Srikanth Sola,Blue Ashva Capital,1000000.0,Seed,2021,Other
2021-10-01,TenderCuts,2011,Chennai,Nishanth Chandran,"Paragon Partners, NABVENTURES",15000000.0,Seed,2021,Consumables
2021-10-01,LegalPay,2019,New Delhi,Kundan Shahi,9Unicorns,169032154.0,Seed,2021,FinTech
2021-10-02,Stelis Biopharma,2007,Bangalore,Pudhucode Radhakrishnan Kannan,"RouteOne, Mankekar Family Office",195000000.0,Series B,2021,Technology
2021-10-02,Aquatein,2019,Mumbai,"Ananth B Prabhala, Mitisha Mehta",Eaglewings Ventures,169032154.0,Seed,2021,Consumables
2021-10-02,Fi,2019,Bangalore,Sumit Gwalani,"Capital Group, Falcon Edge",50000000.0,Series B,2021,Finance
2021-10-02,Imagimake,2011,Mumbai,"Disha Katharani, Ravi Jalan",Velocity,169032154.0,Seed,2021,Consumer Services
2021-10-02,PlanetSpark,2017,Gurugram,"Maneesh Dhooper, Kunal Malik","Binny Bansal, Deep Kalra, Dr Ashish Gupta, Gokul Rajaram, Shirish Nadkarni",13000000.0,Series B,2021,Education
2021-10-03,Chalo,2014,Mumbai,"Mohit Dubey, Nikhil Aggarwal","Amit Singhal, Raine Ventures",7000000.0,Seed,2021,Technology
2021-10-04,Hyperface,2021,Bangalore,"Ramanathan RV, Aishwarya Jaishankar","Kunal Shah, Better Capital",1300000.0,Seed,2021,Technology
2021-10-04,Myelin Foundry,2019,Bangalore,"Gopichand Katragadda, Ganesh Suryanarayanan, Aditi Olemann",Beyond Next Ventures,1000000.0,Pre-series A,2021,Technology
2021-10-04,Darwinbox,2015,Hyderabad,"Chaitanya Peddi, Jayant Paleti, Rohit Chennamaneni","Sequoia Capital India, 3one4 Capital",15000000.0,Seed,2021,Technology
2021-10-05,Shadez,2019,Mumbai,"Adarsh Anand, Amit Tiwari",Inflection Point Ventures,200000.0,Pre-series A,2021,Consumer Services
2021-10-05,Elixia Tech Solutions,2011,Mumbai,Sanket Sheth,Rajasthan Venture Capital Fund,1000000.0,Pre-series A,2021,Technology
2021-10-05,NeoDove,2020,Jaipur,Aprit Khandelwal,India Quotient,15000000.0,Seed,2021,Technology
2021-10-05,Klassroom,2016,Mumbai,Alka Javeri,ah! Ventures,200000.0,Pre-series A,2021,Education
2021-10-05,OfBusiness,2015,Gurugram,"Ruchi Kalra, Asish Mohapatra","Alpha Wave Ventures II, Tiger Global Management, SoftBank Vision Fund II",325000000.0,Seed,2021,Finance
2021-10-05,ParkSmart,2018,New Delhi,"Prateek Garg, Rahul Gupta, Ratan Anmol Sethi, Rishabh Nagpal, Vishva Sharma","Shireen Rangaswamy, Dilesh Gathani",169032154.0,Seed,2021,Automotive
2021-10-05,Pitstop,2015,Bangalore,"Mihir Mohan Mishra, Nirant Ramakuru, Ruchi Deepak","Acko Technology, Services, LetsVenture",3500000.0,Pre-series B,2021,Automotive
2021-10-06,RevFin,2018,New Delhi,Sameer Aggarwal,Shell Foundation,169032154.0,Seed,2021,FinTech
2021-10-06,CARS24,2015,Gurugram,"Mehul Agrawal, Vikram Chopra","DST Global, Falcon Edge, SoftBank Vision Fund 2",450000000.0,Series F,2021,Automotive
2021-10-06,Svasti Microfinance,2008,Mumbai,"Arunkumar Padmanabhan, Narayanan Subramaniam","Kayenne Ventures, Nordic Microfinance Initiative",4000000.0,Seed,2021,FinTech
2021-10-07,Supersourcing,2020,Indore,"Mayank Pratap Singh, Aditi Chaurasia","Vijay Shekhar Sharma, Dr Ritesh Malik",200000.0,Seed,2021,Technology
2021-10-08,TWID,2020,Bangalore,"Amit Sharma, Amit Koshal, Rishi Batra","BEENEXT, Sequoia’s Surge",2500000.0,Seed,2021,FinTech
2021-10-08,Hemp Horizons,2017,Noida,Rohit Shah,Mumbai Angels,200000.0,Seed,2021,Technology
2021-10-09,SuperGaming,2017,Pune,"Roby John, Sanket Nadhani, Navneet Waraich","Skycatcher, AET Fund, BAce Capital, Dream Incubator, 1Up Ventures",5500000.0,Series A,2021,Gaming
2021-10-09,GuardianLink,2017,Chennai,"Ramkumar Subramaniam, Kamesh Elangovan",Kalaari Capital,12000000.0,Series A,2021,Technology
2021-10-10,Fullife Healthcare,2009,Bangalore,Morgan Stanley Private Equity Asia,,22000000.0,Seed,2021,Manufacture
2021-10-10,Pariksha,2015,Pune,"Deepak Choudhary, Karanvir Singh Shekhawat, Utkarsh Bagri, Vikram Shekhawat","Venture Catalysts, 9Unicorns Accelerator Fund",2000000.0,Pre-series A,2021,Education
2021-10-10,LivQuik Technology,2012,Mumbai,Mohit Lalvani,M2P Fintech,4000000.0,Seed,2021,Finance
2021-10-11,Wasabi,2021,Bangalore,"Pradeep Dodle, Nikhil Goenka","021 Capital, Sparrow Capital",1800000.0,Seed,2021,Consumer Services
2021-10-11,Sea6 Energy,2010,Bangalore,"Sailaja Nori, Nelson Vadassery, Sowmya Balendiran, Shrikumar Suryanarayan",Aqua-Spark,9000000.0,Series B,2021,Healthcare
2021-10-11,Advantage Club,2014,Gurugram,Sourabh Deorah,"Y Combinator, Jetty Ventures, Earlsfield Capital, SMC Advisors, Kunal Shah",3300000.0,Pre-series A,2021,Technology
2021-10-11,InfyU Labs,2019,Gandhinagar,"Amit Srivastava, Ankit Chauhan",IAN,200000.0,Seed,2021,Technology
2021-10-11,ReDesyn,2016,Mumbai,"Smriti Dubey, Shikhar Vaidya",Anthill Ventures,300000.0,Pre-series A,2021,Other
2021-10-12,Zolve,2020,Bangalore,Raghunandan G,DST Global,40000000.0,Series A,2021,Finance
2021-10-12,Sporjo,2020,Mumbai,G Srinivvasan,Punit Balan,2000000.0,Seed,2021,Gaming
2021-10-13,SATYA MicroCapital,2017,New Delhi,Vivek Tiwari,"responsAbility Investments, Blue Orchard",10000000.0,Seed,2021,Finance
2021-10-13,Slice,2015,Bangalore,"Rajan Bajaj, Siva Kumar Tangudu","Tiger Global, Insight Partners",220000000.0,Series B,2021,Finance
2021-10-13,Dozee,2015,Bangalore,"Mudit Dandwate, Dandwate",Prime VP,5000000.0,Series A,2021,Automotive
2021-10-14,Spark Studio,2020,Bangalore,Anushree Goenka,Better Capital,169032154.0,Seed,2021,Education
2021-10-15,Rentomojo,2014,Bangalore,Geetansh Bamania,"Accel, Bain Capital",10000000.0,Seed,2021,Logistics
2021-10-15,The ePlane,2016,Chennai,"Pranjal Mehta, Satyanarayanan Chakravarthy","Speciale Invest, Farid Ahsan",1000000.0,Seed,2021,Technology
2021-10-15,Unlu,2020,Gurugram,"Akshay Pruthi, Anurag Dalia, Himanshu Periwal, Vipul Agrawal",EXPERT DOJO,1000000.0,Seed,2021,Lifestyle
2021-10-16,Magenta EV,2017,Mumbai,"Maxson Lewis, Darryl Dias","JITO Angel Network, LetsVenture",15000000.0,Series A,2021,Energy
2021-10-16,The Gourmet Jar,2012,Noida,Apeksha Jain,DevX Venture Fund,150000.0,Seed,2021,Consumables
2021-10-16,Dogsee Chew,2015,Bangalore,"Bhupendra Khanal, Sneh Sharma",Sixth Sense Ventures,7000000.0,Pre-series A,2021,Consumables
2021-10-16,Nexprt,2020,New Delhi,Harsha Vardhan K,Titan Capital,2000000.0,Seed,2021,Consumer Services
2021-10-18,CreatorStack,2019,Bangalore,"Ankit Acharya, Kevin William David",Accel,2000000.0,Seed,2021,Other
2021-10-18,Five Star Finance,1984,Chennai,V K Ranganathan,"TPG Capital Asia, Epiq Capital",234000000.0,Seed,2021,FinTech
2021-10-19,Strata,2019,Bangalore,"Sudarshan Lodha, Priyanka Rathore","Kotak Investment Advisors Limited, Gruhas Proptech",6000000.0,Series A,2021,Real Estate
2021-10-19,Leverage Edu,2017,New Delhi,Akshay Chaturvedi,"Vijay Shekhar Sharma, Rohit Kapoor, Amanpreet Bajaj, Lalit Singh",169032154.0,Seed,2021,Education
2021-10-19,LearnVern,2016,Ahmadabad,"Niral Modi, Aditi Modi",Inflection Point Ventures,1000000.0,Seed,2021,Education
2021-10-20,Biconomy,2019,New Delhi,"Ahmed Al-Balaghi, Aniket Jindal, Sachin Tomar","Binance Labs, Zee Prime Capital",1500000.0,Seed,2021,Technology
2021-10-20,infra.market,2016,Thane,"Souvik Sengupta, Aaditya Sharda",Tiger Global,125000000.0,Series D,2021,Real Estate
2021-10-20,SSA Finserv,2019,Mumbai,Vikas Agarwal,Blue Ashva Capital,3000000.0,Seed,2021,FinTech
2021-10-20,Lenskart,2010,Haryana,"Amit Chaudhary, Peyush Bansal","Kohlberg Kravis Roberts, Temasek Holdings",95000000.0,Seed,2021,Lifestyle
2021-10-21,PumPumPum,2018,Gurugram,Tarun Lawadia,LC Nueva AIF,169032154.0,Seed,2021,Automotive
2021-10-21,Inshorts,2013,Noida,Azhar Iqubal,Vy Capital,60000000.0,Seed,2021,Technology
2021-10-21,Sochcast,2020,Online Media	#REF!,"Vinners, Raj Nayak, Amritaanshu Agrawal",Inflection Point Ventures,169032154.0,Seed,2021,Other
2021-10-22,Oneiric Gaming,2020,Chandigarh,Avneet Singh,Trishneet Arora,169032154.0,Seed,2021,Gaming
2021-10-23,Flipspaces,2011,Mumbai,Kunal Sharma,Prashasta Seth,2000000.0,Pre-series B,2021,Other
2021-10-23,MPL,2018,Bangalore,"Sai Srinivas Kiran GV, Shubh Malhotra",Legatum Capital,169032154.0,Series E,2021,Other
2021-10-23,ZFW Hospitality,2015,New Delhi,Madhav Kasturia,"Mumbai Angels Network, Expert DOJO",150000.0,Pre-seed,2021,Consumables
2021-10-24,Expertrons,2019,Mumbai,"Jatin Solank, Vivek Gupta","Venture Catalysts, Auxano Capital, Venture Garage, Yoga Capital, Ah!Ventures, Lead Angels",2300000.0,Seed,2021,Education
2021-10-24,88academics,2018,New Delhi,Anil Ahuja,Aarin Capital,3000000.0,Pre-series A,2021,Education
2021-10-24,Melorra,2015,Bangalore,Saroja Yeramili,"9Unicorns, Symphony International Holdings Limited, Value Quest",24000000.0,Seed,2021,Lifestyle
2021-10-25,BYJU'S,2011,Bangalore,"Byju Raveendran, Divya Gokulnath","Oxshott Capital Partners, XN Exponent, Edelweiss",300000000.0,Seed,2021,Education
2021-10-26,HappyCredit,2020,Bangalore,"Jitendra Kumar, Ashish Virmani","Kunal Shah, Krishna Kumar",600000.0,Pre-seed,2021,FinTech
2021-10-26,Mensa,2021,Bangalore,Ananth Narayanan,"Alpha Wave Ventures, Falcon Edge Capital",135000000.0,Series B,2021,Wellness/Beauty
2021-10-27,Aqgromalin,2018,Chennai,"Prasanna Manogaran, Bharani CL",Zephyr Peacock,700000.0,Seed,2021,Technology
2021-10-28,PurpleTutor,2019,Mumbai,"Gaurav Perti, Yatish Gupta",IvyCap Ventures,300000.0,Seed,2021,Education
2021-10-28,Atomberg,2012,Mumbai,"Manoj, Sibabrata Das",Jungle Ventures,20000000.0,Seed,2021,Consumer Services
2021-10-28,Klub,2019,Bangalore,"Anurakt Jain, Ishita Verma","9Unicorns, Sequoia Capital India’s Surge",20000000.0,Seed,2021,Finance
2021-10-28,Gramophone,2016,Indore,"Tauseef Khan, Harshit Gupta",Z3Partners,10000000.0,Seed,2021,Technology
2021-10-28,Superpro.ai,2019,Bangalore,"Gaurav Tripathi, Sagar Ramteke, Vijay Goel, Vivek Kumar","SOSV, Omphalos Ventures India",3000000.0,Seed,2021,Media/Entertainment
2021-10-28,Classplus,2017,Noida,"Mukul Rustagi, Bhaswat Agarwal",Tiger Global,65000000.0,Series C,2021,Education
2021-10-28,Fantasy Akhada,2020,Gurugram,Amit Purohit,Harsha Bhogle,600000.0,Seed,2021,Other
2021-10-29,Betterhalf.ai,2016,Bangalore,"Rahul Namdev, Pawan Gupta","Y Combinator, Rehan A Khan",3000000.0,Pre-series A,2021,Lifestyle
2021-10-29,Farmers Fresh Zone,2015,Kochi,Pradeep PS,"IAN Fund, Malabar Angel Network, Native Angel Network",800000.0,Pre-series A,2021,Technology
2021-10-29,Murf.ai,2020,Bangalore,"Sneha Roy, Ankur Edkie, Divyanshu Pandey",Elevation Capital,1500000.0,Seed,2021,Technology
2021-10-29,Fashinza,2020,Gurgaon,"Abhishek Sharma, Pawan Gupta","Accel Partners, Elevation Capital",2600000.0,Seed,2021,Manufacture
2021-10-30,RuleZero,2019,Bangalore,"Satish Mugulavalli, Srinivas Katta","Induslaw, Reddy Futures",1000000.0,Seed,2021,Technology
2021-10-30,Wiz Freight,2020,Chennai,"Ramkumar Govindarajan, Ramkumar Ramachandran",Axilor,3500000.0,Seed,2021,Logistics
2021-10-31,CredAble,2017,Mumbai,Nirav Choksi,"Plutus Wealth, Oaks Asset Management",30000000.0,Series B,2021,Finance
2021-10-31,Arcatron Mobility,2015,Pune,Ganesh Sonawane,Klub,169032154.0,Seed,2021,Automotive
2021-10-31,Slang Labs,2017,Bangalore,Kumar Rangarajan,100x Entrepreneurs,169032154.0,Seed,2021,Other
2021-10-31,Devnagri,2017,Noida,"Nakul Kundra, Himanshu Sharma","enture Catalyst, IPV",600000.0,Seed,2021,Other
2021-10-31,Vital,2018,New Delhi,Rahul Kumar,BLinC Invest,3000000.0,Pre-series A,2021,Other
2021-11-01,SportZchain,2021,Mumbai,Siddharth Jaiswal,"Darq Capital, Jagadeesh Atukuri",400000.0,Pre-seed,2021,Other
2021-11-02,GameEon Studios,2013,Mumbai,Nikhil Malankar,Mumbai Angels Network,320000.0,Seed,2021,Gaming
2021-11-02,Credgenics,2018,New Delhi,"Rishabh Goel, Mayank Khera, Anand Agrawal","Westbridge Capital, Tanglin Venture Partners",25000000.0,Series A,2021,Finance
2021-11-02,Crater.Club,2020,Bangalore,"Vignesh Prasad, Vivan Puri",LC Nueva AIF,700000.0,Seed,2021,Media/Entertainment
2021-11-02,Biocraft Innovation Technology,2019,Noida,"Vibha Mittal, Anubhav Mittal",JITO Angel Network,169032154.0,Pre-seed,2021,Other
2021-11-02,Fable Fintech,2015,Mumbai,Naushad Contractor,Paytm,169032154.0,Series A,2021,FinTech
2021-11-02,CollegeDekho,2015,Gurgaon,Ruchir Arora,"Disrupt ADQ, QIC",35000000.0,Series B,2021,Other
2021-11-02,O’ Be Cocktails,2019,Bangalore,Nitesh Prakash,"First Cheque, Letsventure",400000.0,Seed,2021,Other
2021-11-03,ShopSe,2020,Mumbai,"Pallav Jain, Abhishek Nimonkar, Yagnesh Desai","Chiratae Ventures, BEENEXT",5500000.0,Seed,2021,FinTech
2021-11-03,Lead School,2012,Mumbai,"Smita Deorah, Sumeet Mehta","GSV Ventures, Westbridge Capital",30000000.0,Series D,2021,Education
2021-11-04,Flatheads,2019,Bangalore,"Ganesh Balakrishnan, Utkarsh Biradar","Pankaj Chaddah, Srivatsan Rajan",169032154.0,Seed,2021,Lifestyle
2021-11-04,Hakuna Matata,2006,Chennai,Gengarajan PV,Hardcastle Petrofer,1000000.0,Seed,2021,Technology
2021-11-04,Juicy Chemistry,2014,Coimbatore,"Megha, Pritesh Asher.",Akya Ventures,6300000.0,Series A,2021,Automotive
2021-11-04,Arcana,2019,Bangalore,"Mayur Relekar, Aravindh Kumar, Abhishek Chaudhary","Republic Crypto, Woodstock, DCG, Sahil Lavingia",2300000.0,Seed,2021,Technology
2021-11-04,BankSathi,2020,New Delhi,Jitendra Dhaka,"Dinesh Godara, Anuj Ahuja, Aditya",500000.0,Seed,2021,Finance
2021-11-05,Toplyne,2021,Bangalore,"Rishen Kapoor and Ruchin Kulkarni, Rohit Khanna","Sequoia Capital , Together Fund",2500000.0,Seed,2021,Technology
